- active: false
  city: Online
  country: cz
  course_id: docker
  date_from: 14.04.2020
  date_to: 15.04.2020
  facebook_event: null
  id: docker-praha-14-04-2020
  lang: cs
  length: 2 dny
  linkedin_event: null
  name: Docker
  price: 15 900 CZK
  venue_id: null
- active: false
  city: Online
  country: cz
  course_id: kubernetes
  date_from: 16.04.2020
  date_to: 17.04.2020
  facebook_event: null
  id: kubernetes-praha-16-04-2020
  lang: cs
  length: 2 dny
  linkedin_event: null
  name: Kubernetes
  price: 15 900 CZK
  venue_id: null
- active: false
  city: Online
  country: cz
  course_id: terraform
  date_from: 20.04.2020
  date_to: 20.04.2020
  facebook_event: null
  id: terraform-praha-20-04-2020
  lang: cs
  length: 1 den
  linkedin_event: null
  name: Terraform
  price: 8 900 CZK
  venue_id: null
- active: false
  city: Online
  country: cz
  course_id: gitlab-ci
  date_from: 21.04.2020
  date_to: 21.04.2020
  facebook_event: null
  id: gitlab-ci-praha-21-04-2020
  lang: cs
  length: 1 den
  linkedin_event: null
  name: Gitlab CI
  price: 8 900 CZK
  venue_id: null
- active: false
  city: Online
  country: cz
  course_id: prometheus
  date_from: 24.04.2020
  date_to: 24.04.2020
  facebook_event: null
  id: prometheus-praha-24-04-2020
  lang: cs
  length: 1 den
  linkedin_event: null
  name: Prometheus
  price: 15 900 CZK
  venue_id: null
- active: false
  city: Online
  country: cz
  course_id: rancher
  date_from: 27.04.2020
  date_to: 27.04.2020
  facebook_event: null
  id: rancher-praha-27-04-2020
  lang: cs
  length: 1 den
  linkedin_event: null
  name: Rancher
  price: 8 900 CZK
  venue_id: null
- active: false
  city: Online
  country: cz
  course_id: ansible
  date_from: 01.05.2020
  date_to: 01.05.2020
  facebook_event: null
  id: ansible-praha-01-05-2020
  lang: cs
  length: 1 den
  linkedin_event: null
  name: Ansible
  price: 15 900 CZK
  venue_id: null
- active: false
  city: Online
  country: cz
  course_id: git
  date_from: 15.05.2020
  date_to: 15.05.2020
  facebook_event: null
  id: git-praha-15-05-2020
  lang: cs
  length: 1 den
  linkedin_event: null
  name: Git
  price: 8 900 CZK
  venue_id: null
- active: false
  city: Online
  country: cz
  course_id: git
  date_from: 18.05.2020
  date_to: 18.05.2020
  facebook_event: null
  id: git-online-18-5-2020
  lang: cs
  length: 1 den
  linkedin_event: null
  name: Git
  price: 8 900 CZK
  venue_id: null
- active: false
  city: Online
  country: cz
  course_id: docker
  date_from: 19.05.2020
  date_to: 20.05.2020
  facebook_event: null
  id: docker-online-19-5-2020
  lang: cs
  length: 2 dny
  linkedin_event: null
  name: Docker
  price: 15 900 CZK
  venue_id: null
- active: false
  city: Online
  country: cz
  course_id: docker
  date_from: 25.05.2020
  date_to: 26.05.2020
  facebook_event: null
  id: docker-brno-25-05-2020
  lang: cs
  length: 2 dny
  linkedin_event: null
  name: Docker
  price: 15 900 CZK
  venue_id: null
- active: false
  city: Online
  country: cz
  course_id: gitlab-ci
  date_from: 27.05.2020
  date_to: 27.05.2020
  facebook_event: null
  id: gitlab-ci-brno-27-05-2020
  lang: cs
  length: 1 den
  linkedin_event: null
  name: Gitlab CI
  price: 8 900 CZK
  venue_id: null
- active: false
  city: Online
  country: cz
  course_id: kubernetes
  date_from: 28.05.2020
  date_to: 29.05.2020
  facebook_event: null
  id: kubernetes-brno-28-05-2020
  lang: cs
  length: 2 dny
  linkedin_event: null
  name: Kubernetes
  price: 15 900 CZK
  venue_id: null
- active: false
  city: Online
  country: cz
  course_id: gitlab-ci
  date_from: 03.06.2020
  date_to: 03.06.2020
  facebook_event: null
  id: gitlab-ci-online-3-6-2020
  lang: cs
  length: 1 den
  linkedin_event: null
  name: Gitlab CI
  price: 8 900 CZK
  venue_id: null
- active: false
  city: Online
  country: cz
  course_id: terraform
  date_from: 05.06.2020
  date_to: 05.06.2020
  facebook_event: null
  id: terraform-brno-05-06-2020
  lang: cs
  length: 1 den
  linkedin_event: null
  name: Terraform
  price: 8 900 CZK
  venue_id: null
- active: false
  city: Online
  country: cz
  course_id: kubernetes
  date_from: 08.06.2020
  date_to: 09.06.2020
  facebook_event: null
  id: kubernetes-online-8-6-2020
  lang: cs
  length: 2 dny
  linkedin_event: null
  name: Kubernetes
  price: 15 900 CZK
  venue_id: null
- active: false
  city: Online
  country: cz
  course_id: ansible
  date_from: 10.06.2020
  date_to: 10.06.2020
  facebook_event: null
  id: ansible-online-10-6-2020
  lang: cs
  length: 1 den
  linkedin_event: null
  name: Ansible
  price: 15 900 CZK
  venue_id: null
- active: false
  city: Online
  country: cz
  course_id: prometheus
  date_from: 11.06.2020
  date_to: 11.06.2020
  facebook_event: null
  id: prometheus-online-11-6-2020
  lang: cs
  length: 1 den
  linkedin_event: null
  name: Prometheus
  price: 15 900 CZK
  venue_id: null
- active: false
  city: Online
  country: cz
  course_id: git
  date_from: 12.06.2020
  date_to: 12.06.2020
  facebook_event: null
  id: git-praha-12-06-2020
  lang: cs
  length: 1 den
  linkedin_event: null
  name: Git
  price: 8 900 CZK
  venue_id: null
- active: false
  city: Prague
  country: cz
  course_id: gitlab-ci
  date_from: 20.07.2020
  date_to: 20.07.2020
  facebook_event: null
  id: gitlab-ci-praha-20-07-2020
  lang: cs
  length: 1 den
  linkedin_event: null
  name: Gitlab CI
  price: 8 900 CZK
  venue_id: null
- active: false
  city: Prague
  country: cz
  course_id: docker
  date_from: 21.07.2020
  date_to: 22.07.2020
  facebook_event: null
  id: docker-praha-21-07-2020
  lang: cs
  length: 2 dny
  linkedin_event: null
  name: Docker
  price: 15 900 CZK
  venue_id: null
- active: false
  city: Prague
  country: cz
  course_id: kubernetes
  date_from: 23.07.2020
  date_to: 24.07.2020
  facebook_event: null
  id: kubernetes-praha-23-07-2020
  lang: cs
  length: 2 dny
  linkedin_event: null
  name: Kubernetes
  price: 15 900 CZK
  venue_id: null
- active: false
  city: Prague
  country: cz
  course_id: prometheus
  date_from: 27.07.2020
  date_to: 27.07.2020
  facebook_event: null
  id: prometheus-praha-27-07-2020
  lang: cs
  length: 1 den
  linkedin_event: null
  name: Prometheus
  price: 15 900 CZK
  venue_id: null
- active: false
  city: Prague
  country: cz
  course_id: rancher
  date_from: 28.07.2020
  date_to: 28.07.2020
  facebook_event: null
  id: rancher-praha-28-07-2020
  lang: cs
  length: 1 den
  linkedin_event: null
  name: Rancher
  price: 8 900 CZK
  venue_id: null
- active: false
  city: Prague
  country: cz
  course_id: terraform
  date_from: 29.07.2020
  date_to: 29.07.2020
  facebook_event: null
  id: terraform-praha-29-07-2020
  lang: cs
  length: 1 den
  linkedin_event: null
  name: Terraform
  price: 8 900 CZK
  venue_id: null
- active: false
  city: Prague
  country: cz
  course_id: proxmox
  date_from: 30.07.2020
  date_to: 30.07.2020
  facebook_event: null
  id: proxmox-praha-30-07-2020
  lang: cs
  length: 1 den
  linkedin_event: null
  name: Proxmox
  price: 8 900 CZK
  venue_id: null
- active: false
  city: Prague
  country: cz
  course_id: proxmox
  date_from: 11.09.2020
  date_to: 11.09.2020
  facebook_event: null
  id: proxmox-praha-11-09-2020
  lang: cs
  length: 1 den
  linkedin_event: null
  name: Proxmox
  price: 8 900 CZK
  venue_id: null
- active: false
  city: Prague
  country: cz
  course_id: docker
  date_from: 14.09.2020
  date_to: 15.09.2020
  facebook_event: null
  id: docker-praha-14-09-2020
  lang: cs
  length: 2 dny
  linkedin_event: null
  name: Docker
  price: 15 900 CZK
  venue_id: null
- active: false
  city: Prague
  country: cz
  course_id: gitlab-ci
  date_from: 16.09.2020
  date_to: 16.09.2020
  facebook_event: null
  id: gitlab-ci-praha-16-09-2020
  lang: cs
  length: 1 den
  linkedin_event: null
  name: Gitlab CI
  price: 8 900 CZK
  venue_id: null
- active: false
  city: Prague
  country: cz
  course_id: kubernetes
  date_from: 17.09.2020
  date_to: 18.09.2020
  facebook_event: null
  id: kubernetes-praha-17-09-2020
  lang: cs
  length: 2 dny
  linkedin_event: null
  name: Kubernetes
  price: 15 900 CZK
  venue_id: null
- active: false
  city: Prague
  country: cz
  course_id: terraform
  date_from: 25.09.2020
  date_to: 25.09.2020
  facebook_event: null
  id: terraform-praha-25-09-2020
  lang: cs
  length: 1 den
  linkedin_event: null
  name: Terraform
  price: 8 900 CZK
  venue_id: null
- active: false
  city: Prague
  country: cz
  course_id: digitalocean
  date_from: 02.10.2020
  date_to: 02.10.2020
  facebook_event: null
  id: digitalocean-praha-02-10-2020
  lang: cs
  length: 1 den
  linkedin_event: null
  name: DigitalOcean
  price: 8 900 CZK
  venue_id: null
- active: false
  city: Online
  country: cz
  course_id: prometheus
  date_from: 30.10.2020
  date_to: 30.10.2020
  facebook_event: https://www.facebook.com/events/653319681973039
  id: prometheus-online-30-10-2020
  lang: cs
  length: 1 den
  linkedin_event: https://www.linkedin.com/events/6701470338565316608/
  name: Prometheus
  price: 15 900 CZK
  venue_id: null
- active: false
  city: Online
  country: cz
  course_id: gitlab-ci
  date_from: 04.11.2020
  date_to: 04.11.2020
  facebook_event: https://www.facebook.com/events/800482037357548
  id: gitlab-ci-online-4-11-2020
  lang: cs
  length: 1 den
  linkedin_event: https://www.linkedin.com/events/6699295534529683458/
  name: Gitlab CI
  price: 8 900 CZK
  venue_id: null
- active: false
  city: Online
  country: cz
  course_id: kubernetes
  date_from: 05.11.2020
  date_to: 06.11.2020
  facebook_event: https://www.facebook.com/events/930034360818411
  id: kubernetes-brno-05-11-2020
  lang: cs
  length: 2 dny
  linkedin_event: https://www.linkedin.com/events/6699296409071456256/
  name: Kubernetes
  price: 15 900 CZK
  venue_id: null
- active: false
  city: Prague
  country: cz
  course_id: kubernetes
  date_from: 12.11.2020
  date_to: 13.11.2020
  facebook_event: https://www.facebook.com/events/789692305134266
  id: kubernetes-praha-12-11-2020
  lang: cs
  length: 2 dny
  linkedin_event: https://www.linkedin.com/events/6701122873815257088/
  name: Kubernetes
  price: 15 900 CZK
  venue_id: null
- active: false
  city: Online
  country: cz
  course_id: proxmox
  date_from: 20.11.2020
  date_to: 20.11.2020
  facebook_event: https://www.facebook.com/events/1394533997418347
  id: proxmox-online-20-11-2020
  lang: cs
  length: 1 den
  linkedin_event: https://www.linkedin.com/events/6699588615283978240/
  name: Proxmox
  price: 8 900 CZK
  venue_id: null
- active: false
  city: Online
  country: cz
  course_id: terraform
  date_from: 27.11.2020
  date_to: 27.11.2020
  facebook_event: https://www.facebook.com/events/1322145124794134
  id: terraform-online-27-11-2020
  lang: cs
  length: 1 den
  linkedin_event: https://www.linkedin.com/events/6699591210727698432/
  name: Terraform
  price: 8 900 CZK
  venue_id: null
- active: false
  city: Online
  country: cz
  course_id: digitalocean
  date_from: 04.12.2020
  date_to: 04.12.2020
  facebook_event: https://www.facebook.com/events/643493409913901
  id: digitalocean-online-04-12-2020
  lang: cs
  length: 1 den
  linkedin_event: https://www.linkedin.com/events/6699291594736050176/
  name: DigitalOcean
  price: 8 900 CZK
  venue_id: null
- active: false
  city: Online
  country: cz
  course_id: rancher
  date_from: 11.12.2020
  date_to: 11.12.2020
  facebook_event: https://www.facebook.com/events/1377306179326395
  id: rancher-online-11-12-2020
  lang: cs
  length: 1 den
  linkedin_event: https://www.linkedin.com/events/6701798854485938176/
  name: Rancher
  price: 8 900 CZK
  venue_id: null
- active: false
  city: Online
  country: cz
  course_id: docker
  date_from: 14.12.2020
  date_to: 15.12.2020
  facebook_event: https://www.facebook.com/events/223410545748452
  id: docker-online-02-11-2020
  lang: cs
  length: 2 dny
  linkedin_event: https://www.linkedin.com/events/6699293927184318464/
  name: Docker
  price: 15 900 CZK
  venue_id: null
- active: false
  city: Online
  country: cz
  course_id: kubernetes
  date_from: 17.12.2020
  date_to: 18.12.2020
  facebook_event: null
  id: kubernetes-online-17-12-2021
  lang: cs
  length: 2 dny
  linkedin_event: null
  name: Kubernetes
  price: 15 900 CZK
  venue_id: null
- active: false
  city: Online
  country: cz
  course_id: terraform
  date_from: 21.12.2020
  date_to: 21.12.2020
  facebook_event: null
  id: terraform-online-21-12-2021
  lang: cs
  length: 1 den
  linkedin_event: null
  name: Terraform
  price: 8 900 CZK
  venue_id: null
- active: false
  city: Prague
  country: cz
  course_id: gitlab-ci
  date_from: 25.01.2021
  date_to: 25.01.2021
  facebook_event: null
  id: gitlab-ci-praha-25-01-2021
  lang: cs
  length: 1 den
  linkedin_event: null
  name: Gitlab CI
  price: 8 900 CZK
  venue_id: null
- active: false
  city: Prague
  country: cz
  course_id: docker
  date_from: 26.01.2021
  date_to: 27.01.2021
  facebook_event: null
  id: docker-praha-26-01-2021
  lang: cs
  length: 2 dny
  linkedin_event: null
  name: Docker
  price: 15 900 CZK
  venue_id: null
- active: false
  city: Prague
  country: cz
  course_id: kubernetes
  date_from: 28.01.2021
  date_to: 29.01.2021
  facebook_event: null
  id: kubernetes-praha-28-01-2021
  lang: cs
  length: 2 dny
  linkedin_event: null
  name: Kubernetes
  price: 15 900 CZK
  venue_id: null
- active: false
  city: Prague
  country: cz
  course_id: prometheus
  date_from: 03.02.2021
  date_to: 03.02.2021
  facebook_event: null
  id: prometheus-praha-03-02-2021
  lang: cs
  length: 1 den
  linkedin_event: null
  name: Prometheus
  price: 15 900 CZK
  venue_id: null
- active: false
  city: Prague
  country: cz
  course_id: proxmox
  date_from: 05.02.2021
  date_to: 05.02.2021
  facebook_event: null
  id: proxmox-praha-05-02-2021
  lang: cs
  length: 1 den
  linkedin_event: null
  name: Proxmox
  price: 8 900 CZK
  venue_id: null
- active: false
  city: Online
  country: cz
  course_id: django
  date_from: 10.02.2021
  date_to: 11.02.2021
  facebook_event: null
  id: django-online-10-02-2021
  lang: cs
  length: 2 dny
  linkedin_event: null
  name: Django
  price: 15 900 CZK
  venue_id: null
- active: false
  city: Prague
  country: cz
  course_id: ansible
  date_from: 25.03.2021
  date_to: 26.03.2021
  facebook_event: null
  id: ansible-praha-25-03-2021
  lang: cs
  length: 2 dny
  linkedin_event: null
  name: Ansible
  price: 15 900 CZK
  venue_id: null
- active: false
  city: Online
  country: cz
  course_id: gitlab-ci
  date_from: 01.04.2021
  date_to: 01.04.2021
  facebook_event: null
  id: gitlab-ci-online-01-04-2021
  lang: cs
  length: 1 den
  linkedin_event: null
  name: Gitlab CI
  price: 8 900 CZK
  venue_id: null
- active: false
  city: Prague
  country: cz
  course_id: terraform
  date_from: 06.04.2021
  date_to: 06.04.2021
  facebook_event: null
  id: terraform-praha-06-04-2021
  lang: cs
  length: 1 den
  linkedin_event: null
  name: Terraform
  price: 8 900 CZK
  venue_id: null
- active: false
  city: Prague
  country: cz
  course_id: rancher
  date_from: 07.04.2021
  date_to: 07.04.2021
  facebook_event: null
  id: rancher-praha-07-04-2021
  lang: cs
  length: 1 den
  linkedin_event: null
  name: Rancher
  price: 8 900 CZK
  venue_id: null
- active: false
  city: Prague
  country: cz
  course_id: digitalocean
  date_from: 08.04.2021
  date_to: 08.04.2021
  facebook_event: null
  id: digitalocean-praha-08-04-2021
  lang: cs
  length: 1 den
  linkedin_event: null
  name: DigitalOcean
  price: 8 900 CZK
  venue_id: null
- active: false
  city: Online
  country: cz
  course_id: docker
  date_from: 12.04.2021
  date_to: 13.04.2021
  facebook_event: null
  id: docker-online-12-04-2021
  lang: cs
  length: 2 dny
  linkedin_event: null
  name: Docker
  price: 15 900 CZK
  venue_id: null
- active: false
  city: Online
  country: cz
  course_id: kubernetes
  date_from: 15.04.2021
  date_to: 16.04.2021
  facebook_event: null
  id: kubernetes-online-15-04-2021
  lang: cs
  length: 2 dny
  linkedin_event: null
  name: Kubernetes
  price: 15 900 CZK
  venue_id: null
- active: false
  city: Online
  country: cz
  course_id: prometheus
  date_from: 26.04.2021
  date_to: 27.04.2021
  facebook_event: null
  id: prometheus-online-26-04-2021
  lang: cs
  length: 2 dny
  linkedin_event: null
  name: Prometheus
  price: 15 900 CZK
  venue_id: null
- active: false
  city: Online
  country: cz
  course_id: proxmox
  date_from: 28.04.2021
  date_to: 28.04.2021
  facebook_event: null
  id: proxmox-online-28-04-2021
  lang: cs
  length: 1 den
  linkedin_event: null
  name: Proxmox
  price: 8 900 CZK
  venue_id: null
- active: false
  city: Online
  country: cz
  course_id: gitlab-ci
  date_from: 04.06.2021
  date_to: 04.06.2021
  facebook_event: null
  id: gitlab-ci-online-04-06-2021
  lang: cs
  length: 1 den
  linkedin_event: null
  name: Gitlab CI
  price: 8 900 CZK
  venue_id: null
- active: false
  city: Online
  country: cz
  course_id: docker
  date_from: 07.06.2021
  date_to: 08.06.2021
  facebook_event: null
  id: docker-online-07-06-2021
  lang: cs
  length: 2 dny
  linkedin_event: null
  name: Docker
  price: 15 900 CZK
  venue_id: null
- active: false
  city: Online
  country: cz
  course_id: kubernetes
  date_from: 09.06.2021
  date_to: 10.06.2021
  facebook_event: null
  id: kubernetes-online-09-06-2021
  lang: cs
  length: 2 dny
  linkedin_event: null
  name: Kubernetes
  price: 15 900 CZK
  venue_id: null
- active: false
  city: Online
  country: cz
  course_id: terraform
  date_from: 15.06.2021
  date_to: 15.06.2021
  facebook_event: null
  id: terraform-online-15-06-2021
  lang: cs
  length: 1 den
  linkedin_event: null
  name: Terraform
  price: 8 900 CZK
  venue_id: null
- active: false
  city: Online
  country: cz
  course_id: rancher
  date_from: 16.06.2021
  date_to: 16.06.2021
  facebook_event: null
  id: rancher-online-16-06-2021
  lang: cs
  length: 1 den
  linkedin_event: null
  name: Rancher
  price: 8 900 CZK
  venue_id: null
- active: false
  city: Online
  country: cz
  course_id: prometheus
  date_from: 17.06.2021
  date_to: 18.06.2021
  facebook_event: null
  id: prometheus-online-17-06-2021
  lang: cs
  length: 2 dny
  linkedin_event: null
  name: Prometheus
  price: 15 900 CZK
  venue_id: null
- active: false
  city: Online
  country: cz
  course_id: digitalocean
  date_from: 22.06.2021
  date_to: 22.06.2021
  facebook_event: null
  id: digitalocean-online-22-06-2021
  lang: cs
  length: 1 den
  linkedin_event: null
  name: DigitalOcean
  price: 8 900 CZK
  venue_id: null
- active: false
  city: Online
  country: cz
  course_id: proxmox
  date_from: 23.06.2021
  date_to: 23.06.2021
  facebook_event: null
  id: proxmox-online-23-06-2021
  lang: cs
  length: 1 den
  linkedin_event: null
  name: Proxmox
  price: 8 900 CZK
  venue_id: null
- active: false
  city: Online
  country: cz
  course_id: gitlab-ci
  date_from: 12.08.2021
  date_to: 12.08.2021
  facebook_event: null
  id: gitlab-ci-online-12-08-2021
  lang: cs
  length: 1 den
  linkedin_event: null
  name: Gitlab CI
  price: 8 900 CZK
  venue_id: null
- active: false
  city: Online
  country: cz
  course_id: docker
  date_from: 16.08.2021
  date_to: 17.08.2021
  facebook_event: null
  id: docker-online-16-08-2021
  lang: cs
  length: 2 dny
  linkedin_event: null
  name: Docker
  price: 15 900 CZK
  venue_id: null
- active: false
  city: Online
  country: cz
  course_id: kubernetes
  date_from: 18.08.2021
  date_to: 19.08.2021
  facebook_event: null
  id: kubernetes-online-18-08-2021
  lang: cs
  length: 2 dny
  linkedin_event: null
  name: Kubernetes
  price: 15 900 CZK
  venue_id: null
- active: false
  city: Online
  country: cz
  course_id: terraform
  date_from: 23.08.2021
  date_to: 23.08.2021
  facebook_event: null
  id: terraform-online-23-08-2021
  lang: cs
  length: 1 den
  linkedin_event: null
  name: Terraform
  price: 8 900 CZK
  venue_id: null
- active: false
  city: Online
  country: cz
  course_id: rancher
  date_from: 24.08.2021
  date_to: 24.08.2021
  facebook_event: null
  id: rancher-online-24-08-2021
  lang: cs
  length: 1 den
  linkedin_event: null
  name: Rancher
  price: 8 900 CZK
  venue_id: null
- active: false
  city: Online
  country: cz
  course_id: prometheus
  date_from: 26.08.2021
  date_to: 27.08.2021
  facebook_event: null
  id: prometheus-online-26-08-2021
  lang: cs
  length: 2 dny
  linkedin_event: null
  name: Prometheus
  price: 15 900 CZK
  venue_id: null
- active: false
  city: Online
  country: cz
  course_id: digitalocean
  date_from: 31.08.2021
  date_to: 31.08.2021
  facebook_event: null
  id: digitalocean-online-31-08-2021
  lang: cs
  length: 1 den
  linkedin_event: null
  name: DigitalOcean
  price: 8 900 CZK
  venue_id: null
- active: false
  city: Online
  country: cz
  course_id: proxmox
  date_from: 01.09.2021
  date_to: 01.09.2021
  facebook_event: null
  id: proxmox-online-01-09-2021
  lang: cs
  length: 1 den
  linkedin_event: null
  name: Proxmox
  price: 8 900 CZK
  venue_id: null
- active: false
  city: Prague
  country: cz
  course_id: ansible
  date_from: 16.09.2021
  date_to: 17.09.2021
  facebook_event: null
  id: ansible-praha-16-09-2021
  lang: cs
  length: 2 dny
  linkedin_event: null
  name: Ansible
  price: 15 900 CZK
  venue_id: null
- active: false
  city: Online
  country: cz
  course_id: gitlab-ci
  date_from: 29.09.2021
  date_to: 29.09.2021
  facebook_event: null
  id: gitlab-ci-online-29-09-2021
  lang: cs
  length: 1 den
  linkedin_event: null
  name: Gitlab CI
  price: 8 900 CZK
  venue_id: null
- active: false
  city: Online
  country: cz
  course_id: docker
  date_from: 30.09.2021
  date_to: 01.10.2021
  facebook_event: null
  id: docker-online-30-09-2021
  lang: cs
  length: 2 dny
  linkedin_event: null
  name: Docker
  price: 15 900 CZK
  venue_id: null
- active: false
  city: Online
  country: cz
  course_id: argocd
  date_from: 07.10.2021
  date_to: 07.10.2021
  facebook_event: null
  id: argocd-7-10-2021
  lang: cs
  length: 1 den
  linkedin_event: null
  name: ArgoCD
  price: 8 900 CZK
  venue_id: null
- active: false
  city: Online
  country: cz
  course_id: kubernetes
  date_from: 12.10.2021
  date_to: 13.10.2021
  facebook_event: null
  id: kubernetes-online-12-10-2021
  lang: cs
  length: 2 dny
  linkedin_event: null
  name: Kubernetes
  price: 15 900 CZK
  venue_id: null
- active: false
  city: Online
  country: cz
  course_id: terraform
  date_from: 14.10.2021
  date_to: 14.10.2021
  facebook_event: null
  id: terraform-online-14-10-2021
  lang: cs
  length: 1 den
  linkedin_event: null
  name: Terraform
  price: 8 900 CZK
  venue_id: null
- active: false
  city: Online
  country: cz
  course_id: rancher
  date_from: 19.10.2021
  date_to: 19.10.2021
  facebook_event: null
  id: rancher-online-19-10-2021
  lang: cs
  length: 1 den
  linkedin_event: null
  name: Rancher
  price: 8 900 CZK
  venue_id: null
- active: false
  city: Online
  country: cz
  course_id: prometheus
  date_from: 20.10.2021
  date_to: 21.10.2021
  facebook_event: null
  id: prometheus-online-20-10-2021
  lang: cs
  length: 2 dny
  linkedin_event: null
  name: Prometheus
  price: 15 900 CZK
  venue_id: null
- active: false
  city: Online
  country: cz
  course_id: digitalocean
  date_from: 26.10.2021
  date_to: 26.10.2021
  facebook_event: null
  id: digitalocean-online-26-10-2021
  lang: cs
  length: 1 den
  linkedin_event: null
  name: DigitalOcean
  price: 8 900 CZK
  venue_id: null
- active: false
  city: Online
  country: cz
  course_id: proxmox
  date_from: 27.10.2021
  date_to: 27.10.2021
  facebook_event: null
  id: proxmox-online-27-10-2021
  lang: cs
  length: 1 den
  linkedin_event: null
  name: Proxmox
  price: 8 900 CZK
  venue_id: null
- active: false
  city: Online
  country: cz
  course_id: gitlab-ci
  date_from: 18.11.2021
  date_to: 18.11.2021
  facebook_event: null
  id: gitlab-ci-online-18-11-2021
  lang: cs
  length: 1 den
  linkedin_event: null
  name: Gitlab CI
  price: 8 900 CZK
  venue_id: null
- active: false
  city: Prague
  country: cz
  course_id: docker
  date_from: 22.11.2021
  date_to: 23.11.2021
  facebook_event: null
  id: docker-praha-22-11-2021
  lang: cs
  length: 2 dny
  linkedin_event: null
  name: Docker
  price: 15 900 CZK
  venue_id: null
- active: false
  city: Prague
  country: cz
  course_id: kubernetes
  date_from: 25.11.2021
  date_to: 26.11.2021
  facebook_event: null
  id: docker-praha-25-11-2021
  lang: cs
  length: 2 dny
  linkedin_event: null
  name: Kubernetes
  price: 15 900 CZK
  venue_id: null
- active: false
  city: Online
  country: cz
  course_id: terraform
  date_from: 03.12.2021
  date_to: 03.12.2021
  facebook_event: null
  id: terraform-online-03-12-2021
  lang: cs
  length: 1 den
  linkedin_event: null
  name: Terraform
  price: 8 900 CZK
  venue_id: null
- active: false
  city: Prague
  country: cz
  course_id: rancher
  date_from: 07.12.2021
  date_to: 07.12.2021
  facebook_event: null
  id: rancher-praha-07-12-2021
  lang: cs
  length: 1 den
  linkedin_event: null
  name: Rancher
  price: 8 900 CZK
  venue_id: null
- active: false
  city: Prague
  country: cz
  course_id: prometheus
  date_from: 08.12.2021
  date_to: 09.12.2021
  facebook_event: null
  id: prometheus-praha-08-12-2021
  lang: cs
  length: 2 dny
  linkedin_event: null
  name: Prometheus
  price: 15 900 CZK
  venue_id: null
- active: false
  city: Online
  country: cz
  course_id: digitalocean
  date_from: 14.12.2021
  date_to: 14.12.2021
  facebook_event: null
  id: digitalocean-online-14-12-2021
  lang: cs
  length: 1 den
  linkedin_event: null
  name: DigitalOcean
  price: 8 900 CZK
  venue_id: null
- active: false
  city: Online
  country: cz
  course_id: proxmox
  date_from: 15.12.2021
  date_to: 15.12.2021
  facebook_event: null
  id: proxmox-online-15-12-2021
  lang: cs
  length: 1 den
  linkedin_event: null
  name: Proxmox
  price: 8 900 CZK
  venue_id: null
- active: false
  city: Online
  country: cz
  course_id: proxmox
  date_from: 31.01.2022
  date_to: 31.01.2022
  facebook_event: null
  id: proxmox-2022-01-31
  lang: cs
  length: 1 den
  linkedin_event: null
  name: Proxmox
  price: 8 900 CZK
  venue_id: null
- active: false
  city: Online
  country: cz
  course_id: terraform
  date_from: 01.02.2022
  date_to: 01.02.2022
  facebook_event: null
  id: terraform-online-2022-02-01
  lang: cs
  length: 1 den
  linkedin_event: null
  name: Terraform
  price: 8 900 CZK
  venue_id: null
- active: false
  city: Prague
  country: cz
  course_id: gitlab-ci
  date_from: 07.02.2022
  date_to: 07.02.2022
  facebook_event: null
  id: GitlabCI-2022-02-07
  lang: cs
  length: 1 den
  linkedin_event: null
  name: Gitlab CI
  price: 8 900 CZK
  venue_id: null
- active: true
  city: Prague
  country: cz
  course_id: docker
  date_from: 08.02.2022
  date_to: 09.02.2022
  facebook_event: null
  id: Docker-02-08
  lang: cs
  length: 2 dny
  linkedin_event: null
  name: Docker
  price: 15 900 CZK
  venue_id: null
- active: true
  city: Prague
  country: cz
  course_id: kubernetes
  date_from: 14.02.2022
  date_to: 15.02.2022
  facebook_event: null
  id: kubernetes-2022-02-14
  lang: cs
  length: 2 dny
  linkedin_event: null
  name: Kubernetes
  price: 15 900 CZK
  venue_id: null
- active: true
  city: Prague
  country: cz
  course_id: cloudflare
  date_from: 09.03.2022
  date_to: 09.03.2022
  facebook_event: null
  id: Cloudflare-03-09
  lang: cs
  length: 1 den
  linkedin_event: null
  name: Cloudflare
  price: 8 900 CZK
  venue_id: null
- active: true
  city: Prague
  country: cz
  course_id: rancher
  date_from: 14.03.2022
  date_to: 14.03.2022
  facebook_event: null
  id: Rancher-2022-03-14
  lang: cs
  length: 1 den
  linkedin_event: null
  name: Rancher
  price: 8 900 CZK
  venue_id: null
- active: true
  city: Prague
  country: cz
  course_id: argocd
  date_from: 21.03.2022
  date_to: 21.03.2022
  facebook_event: null
  id: Argocd-2022-03-21
  lang: cs
  length: 1 den
  linkedin_event: null
  name: ArgoCD
  price: 8 900 CZK
  venue_id: null
- active: true
  city: Prague
  country: cz
  course_id: vault
  date_from: 23.03.2022
  date_to: 23.03.2022
  facebook_event: null
  id: vault-2022-03-23
  lang: cs
  length: 1 den
  linkedin_event: null
  name: Vault
  price: 8 900 CZK
  venue_id: null
- active: true
  city: Prague
  country: cz
  course_id: aws
  date_from: 04.04.2022
  date_to: 05.04.2022
  facebook_event: null
  id: zakladyaws-2022-04-04
  lang: cs
  length: 2 dny
  linkedin_event: null
  name: "Z\xE1klady AWS"
  price: 15 900 CZK
  venue_id: null
- active: true
  city: Prague
  country: cz
  course_id: prometheus
  date_from: 11.04.2022
  date_to: 12.04.2022
  facebook_event: null
  id: prometheus-2022-04-11
  lang: cs
  length: 2 dny
  linkedin_event: null
  name: Prometheus
  price: 15 900 CZK
  venue_id: null
- active: true
  city: Prague
  country: cz
  course_id: terraform
  date_from: 13.04.2022
  date_to: 13.04.2022
  facebook_event: null
  id: terraform-
  lang: cs
  length: 1 den
  linkedin_event: null
  name: Terraform
  price: 8 900 CZK
  venue_id: null
- active: true
  city: Prague
  country: cz
  course_id: openshift
  date_from: 25.04.2022
  date_to: 26.04.2022
  facebook_event: null
  id: openshift-a-okd-2022-04-25
  lang: cs
  length: 2 dny
  linkedin_event: null
  name: OpenShift a OKD
  price: 15 900 CZK
  venue_id: null
- active: true
  city: Prague
  country: cz
  course_id: packer
  date_from: 02.05.2022
  date_to: 02.05.2022
  facebook_event: null
  id: packer-2022-05-02
  lang: cs
  length: 1 den
  linkedin_event: null
  name: Packer
  price: 8 900 CZK
  venue_id: null
- active: true
  city: Prague
  country: cz
  course_id: proxmox
  date_from: 09.05.2022
  date_to: 09.05.2022
  facebook_event: null
  id: proxmox-2022-05-09
  lang: cs
  length: 1 den
  linkedin_event: null
  name: Proxmox
  price: 8 900 CZK
  venue_id: null
- active: true
  city: Prague
  country: cz
  course_id: docker
  date_from: 23.05.2022
  date_to: 24.05.2022
  facebook_event: null
  id: Docker-2022-05-23
  lang: cs
  length: 2 dny
  linkedin_event: null
  name: Docker
  price: 15 900 CZK
  venue_id: null
- active: true
  city: Prague
  country: cz
  course_id: kubernetes
  date_from: 30.05.2022
  date_to: 31.05.2022
  facebook_event: null
  id: kubernetes-2022-05-30
  lang: cs
  length: 2 dny
  linkedin_event: null
  name: Kubernetes
  price: 15 900 CZK
  venue_id: null
- active: true
  city: Prague
  country: cz
  course_id: go
  date_from: 06.06.2022
  date_to: 07.06.2022
  facebook_event: null
  id: uvod-do-go-golang-2022-06-06
  lang: cs
  length: 2 dny
  linkedin_event: null
  name: "\xDAvod do Go (Golang)"
  price: 15 900 CZK
  venue_id: null
- active: true
  city: Prague
  country: cz
  course_id: openstack
  date_from: 15.06.2022
  date_to: 16.06.2022
  facebook_event: null
  id: openstack-pro-vycojare-2022-06-15
  lang: cs
  length: 2 dny
  linkedin_event: null
  name: "OpenStack pro v\xFDvoj\xE1\u0159e"
  price: 15 900 CZK
  venue_id: null
- active: true
  city: Prague
  country: cz
  course_id: terraform
  date_from: 12.09.2022
  date_to: 12.09.2022
  facebook_event: null
  id: Terraform-2022-09-12
  lang: cs
  length: 1 den
  linkedin_event: null
  name: Terraform
  price: 8 900 CZK
  venue_id: null
- active: true
  city: Prague
  country: cz
  course_id: go
  date_from: 19.09.2022
  date_to: 20.09.2022
  facebook_event: null
  id: Uvod-do-go-golang-2022-09-19
  lang: cs
  length: 2 dny
  linkedin_event: null
  name: "\xDAvod do Go (Golang)"
  price: 15 900 CZK
  venue_id: null
- active: true
  city: Prague
  country: cz
  course_id: openshift
  date_from: 26.09.2022
  date_to: 27.09.2022
  facebook_event: null
  id: openshift-a-okd-2022-09-26
  lang: cs
  length: 2 dny
  linkedin_event: null
  name: OpenShift a OKD
  price: 15 900 CZK
  venue_id: null
- active: true
  city: Prague
  country: cz
  course_id: docker
  date_from: 10.10.2022
  date_to: 11.10.2022
  facebook_event: null
  id: docker-2022-10-10
  lang: cs
  length: 2 dny
  linkedin_event: null
  name: Docker
  price: 15 900 CZK
  venue_id: null
- active: true
  city: Prague
  country: cz
  course_id: kubernetes
  date_from: 17.10.2022
  date_to: 18.10.2022
  facebook_event: null
  id: kubernetes-2022-10-17
  lang: cs
  length: 2 dny
  linkedin_event: null
  name: Kubernetes
  price: 15 900 CZK
  venue_id: null
- active: true
  city: Prague
  country: cz
  course_id: openstack
  date_from: 19.10.2022
  date_to: 20.10.2022
  facebook_event: null
  id: OpenStack-pro-vyvojare-2022-10-19
  lang: cs
  length: 2 dny
  linkedin_event: null
  name: "OpenStack pro v\xFDvoj\xE1\u0159e"
  price: 15 900 CZK
  venue_id: null
- active: true
  city: Prague
  country: cz
  course_id: prometheus
  date_from: 31.10.2022
  date_to: 01.11.2022
  facebook_event: null
  id: prometheus-2022-10-31
  lang: cs
  length: 2 dny
  linkedin_event: null
  name: Prometheus
  price: 15 900 CZK
  venue_id: null
- active: true
  city: Prague
  country: cz
  course_id: packer
  date_from: 07.11.2022
  date_to: 07.11.2022
  facebook_event: null
  id: packer-2022-11-07
  lang: cs
  length: 1 den
  linkedin_event: null
  name: Packer
  price: 8 900 CZK
  venue_id: null
- active: true
  city: Prague
  country: cz
  course_id: aws
  date_from: 14.11.2022
  date_to: 15.11.2022
  facebook_event: null
  id: zakladyaws-2022-11-14
  lang: cs
  length: 2 dny
  linkedin_event: null
  name: "Z\xE1klady AWS"
  price: 15 900 CZK
  venue_id: null
- active: true
  city: Prague
  country: cz
  course_id: argocd
  date_from: 21.11.2022
  date_to: 21.11.2022
  facebook_event: null
  id: ArgoCD-2022-11-21
  lang: cs
  length: 1 den
  linkedin_event: null
  name: ArgoCD
  price: 8 900 CZK
  venue_id: null
- active: true
  city: Prague
  country: cz
  course_id: vault
  date_from: 05.12.2022
  date_to: 05.12.2022
  facebook_event: null
  id: vault-2022-12-05
  lang: cs
  length: 1 den
  linkedin_event: null
  name: Vault
  price: 8 900 CZK
  venue_id: null
- active: true
  city: Prague
  country: cz
  course_id: proxmox
  date_from: 12.12.2022
  date_to: 12.12.2022
  facebook_event: null
  id: proxmox-2022-12-12
  lang: cs
  length: 1 den
  linkedin_event: null
  name: Proxmox
  price: 8 900 CZK
  venue_id: null
- active: true
  city: Prague
  country: cz
  course_id: rancher
  date_from: 19.12.2022
  date_to: 19.12.2022
  facebook_event: null
  id: rancher-2022-12-19
  lang: cs
  length: 1 den
  linkedin_event: null
  name: Rancher
  price: 8 900 CZK
  venue_id: null
